[I 2026-09-19 11:25:40,804] Using an existing study with `study_name='mtl_v2'` instead of creating a new one.
trial 1: IC 0.0091  valSharpe 0.951  best_ep 22  params {'dropout': 0.1, 'lr': 0.0005278020781441329, 'weight_decay': 0.00034534668523442173, 'w_return': 0.5, 'lambda_turnover': 0.0, 'target_mode': 'cs_demean'}
[I 2026-09-19 11:30:41,548] Trial 1 finished with value: 0.009093490096529606 and parameters: {'dropout': 0.1, 'lr': 0.0005278020781441329, 'weight_decay': 0.00034534668523442173, 'w_return': 0.5, 'lambda_turnover': 0.0, 'target_mode': 'cs_demean'}. Best is trial 1 with value: 0.009093490096529606.
trial 2: IC -0.0402  valSharpe -0.028  best_ep 2  params {'dropout': 0.4, 'lr': 0.00010626180310555975, 'weight_decay': 0.0009735930289734787, 'w_return': 0.7, 'lambda_turnover': 1.0, 'target_mode': 'raw'}
[I 2026-09-19 11:33:15,229] Trial 2 finished with value: -0.04016917732723203 and parameters: {'dropout': 0.4, 'lr': 0.00010626180310555975, 'weight_decay': 0.0009735930289734787, 'w_return': 0.7, 'lambda_turnover': 1.0, 'target_mode': 'raw'}. Best is trial 0 with value: 0.0245248672300344.
trial 4: IC 0.0533  valSharpe 2.928  best_ep 11  params {'dropout': 0.5, 'lr': 0.0020575759239583216, 'weight_decay': 0.0007732958834834611, 'w_return': 0.6000000000000001, 'lambda_turnover': 0.0, 'target_mode': 'raw'}
[I 2026-09-19 11:36:28,580] Trial 4 finished with value: 0.053341794983132365 and parameters: {'dropout': 0.5, 'lr': 0.0020575759239583216, 'weight_decay': 0.0007732958834834611, 'w_return': 0.6000000000000001, 'lambda_turnover': 0.0, 'target_mode': 'raw'}. Best is trial 4 with value: 0.053341794983132365.
trial 5: IC -0.0013  valSharpe 0.401  best_ep 9  params {'dropout': 0.1, 'lr': 0.0004893380480393623, 'weight_decay': 0.0005372782820914546, 'w_return': 0.3, 'lambda_turnover': 1.0, 'target_mode': 'raw'}
[I 2026-09-19 11:40:38,046] Trial 5 finished with value: -0.0013485754367213315 and parameters: {'dropout': 0.1, 'lr': 0.0004893380480393623, 'weight_decay': 0.0005372782820914546, 'w_return': 0.3, 'lambda_turnover': 1.0, 'target_mode': 'raw'}. Best is trial 4 with value: 0.053341794983132365.
trial 8: IC -0.0315  valSharpe 0.033  best_ep 1  params {'dropout': 0.4, 'lr': 0.00019017329039652483, 'weight_decay': 7.032710845572548e-06, 'w_return': 0.4, 'lambda_turnover': 1.0, 'target_mode': 'cs_demean'}
[I 2026-09-19 11:43:00,634] Trial 8 finished with value: -0.03154747987574735 and parameters: {'dropout': 0.4, 'lr': 0.00019017329039652483, 'weight_decay': 7.032710845572548e-06, 'w_return': 0.4, 'lambda_turnover': 1.0, 'target_mode': 'cs_demean'}. Best is trial 4 with value: 0.053341794983132365.
trial 10: IC -0.0035  valSharpe 0.670  best_ep 1  params {'dropout': 0.5, 'lr': 0.00019140535361524013, 'weight_decay': 0.00010101632710930021, 'w_return': 0.3, 'lambda_turnover': 0.0, 'target_mode': 'raw'}
[I 2026-09-19 11:44:41,318] Trial 10 finished with value: -0.0034946056982531155 and parameters: {'dropout': 0.5, 'lr': 0.00019140535361524013, 'weight_decay': 0.00010101632710930021, 'w_return': 0.3, 'lambda_turnover': 0.0, 'target_mode': 'raw'}. Best is trial 9 with value: 0.0788185978155583.
trial 12: IC 0.0426  valSharpe 1.667  best_ep 5  params {'dropout': 0.5, 'lr': 0.002704477563475979, 'weight_decay': 0.0002914924572442785, 'w_return': 0.7, 'lambda_turnover': 0.0, 'target_mode': 'raw'}
[I 2026-09-19 11:46:57,975] Trial 12 finished with value: 0.04264922008083102 and parameters: {'dropout': 0.5, 'lr': 0.002704477563475979, 'weight_decay': 0.0002914924572442785, 'w_return': 0.7, 'lambda_turnover': 0.0, 'target_mode': 'raw'}. Best is trial 9 with value: 0.0788185978155583.
trial 14: IC -0.0107  valSharpe 1.457  best_ep 5  params {'dropout': 0.2, 'lr': 0.00118110317952193, 'weight_decay': 0.00010914010322489553, 'w_return': 0.7, 'lambda_turnover': 0.0, 'target_mode': 'raw'}
[I 2026-09-19 11:49:14,835] Trial 14 finished with value: -0.010696750058452189 and parameters: {'dropout': 0.2, 'lr': 0.00118110317952193, 'weight_decay': 0.00010914010322489553, 'w_return': 0.7, 'lambda_turnover': 0.0, 'target_mode': 'raw'}. Best is trial 9 with value: 0.0788185978155583.
trial 16: IC 0.0171  valSharpe 1.053  best_ep 9  params {'dropout': 0.4, 'lr': 0.002241893616543548, 'weight_decay': 0.0009315770428860989, 'w_return': 0.7, 'lambda_turnover': 0.1, 'target_mode': 'raw'}
[I 2026-09-19 11:53:26,960] Trial 16 finished with value: 0.017076388656935778 and parameters: {'dropout': 0.4, 'lr': 0.002241893616543548, 'weight_decay': 0.0009315770428860989, 'w_return': 0.7, 'lambda_turnover': 0.1, 'target_mode': 'raw'}. Best is trial 9 with value: 0.0788185978155583.
trial 19: IC 0.0125  valSharpe 0.952  best_ep 2  params {'dropout': 0.30000000000000004, 'lr': 0.0015436464551106055, 'weight_decay': 3.1578563164872315e-05, 'w_return': 0.7, 'lambda_turnover': 0.0, 'target_mode': 'raw'}
[I 2026-09-19 11:55:17,241] Trial 19 finished with value: 0.012529643608670961 and parameters: {'dropout': 0.30000000000000004, 'lr': 0.0015436464551106055, 'weight_decay': 3.1578563164872315e-05, 'w_return': 0.7, 'lambda_turnover': 0.0, 'target_mode': 'raw'}. Best is trial 9 with value: 0.0788185978155583.
trial 21: IC 0.0308  valSharpe 1.093  best_ep 5  params {'dropout': 0.30000000000000004, 'lr': 0.002356724841181592, 'weight_decay': 0.0004414908630587025, 'w_return': 0.6000000000000001, 'lambda_turnover': 0.0, 'target_mode': 'raw'}
[I 2026-09-19 11:57:35,340] Trial 21 finished with value: 0.03084187848625539 and parameters: {'dropout': 0.30000000000000004, 'lr': 0.002356724841181592, 'weight_decay': 0.0004414908630587025, 'w_return': 0.6000000000000001, 'lambda_turnover': 0.0, 'target_mode': 'raw'}. Best is trial 9 with value: 0.0788185978155583.
trial 23: IC 0.0177  valSharpe 1.106  best_ep 15  params {'dropout': 0.5, 'lr': 0.0026023345279201503, 'weight_decay': 7.004784522112841e-05, 'w_return': 0.6000000000000001, 'lambda_turnover': 0.0, 'target_mode': 'cs_demean'}
[I 2026-09-19 12:01:02,389] Trial 23 finished with value: 0.017748588797221018 and parameters: {'dropout': 0.5, 'lr': 0.0026023345279201503, 'weight_decay': 7.004784522112841e-05, 'w_return': 0.6000000000000001, 'lambda_turnover': 0.0, 'target_mode': 'cs_demean'}. Best is trial 9 with value: 0.0788185978155583.
BEST: {'params': {'dropout': 0.30000000000000004, 'lr': 0.0028781002826092387, 'weight_decay': 0.0005717421310401361, 'w_return': 0.6000000000000001, 'lambda_turnover': 0.0, 'target_mode': 'raw'}, 'val_ic': 0.0788185978155583, 'best_epoch': 4, 'val_sharpe': 3.066010344903518}
