[I 2026-09-19 11:25:40,802] A new study created in RDB with name: mtl_v2
trial 0: IC 0.0245  valSharpe 0.553  best_ep 12  params {'dropout': 0.2, 'lr': 0.002601585459268863, 'weight_decay': 0.0002046156259980362, 'w_return': 0.8, 'lambda_turnover': 0.3, 'target_mode': 'cs_demean'}
[I 2026-09-19 11:30:45,121] Trial 0 finished with value: 0.0245248672300344 and parameters: {'dropout': 0.2, 'lr': 0.002601585459268863, 'weight_decay': 0.0002046156259980362, 'w_return': 0.8, 'lambda_turnover': 0.3, 'target_mode': 'cs_demean'}. Best is trial 0 with value: 0.0245248672300344.
trial 3: IC -0.0001  valSharpe 1.529  best_ep 17  params {'dropout': 0.1, 'lr': 0.0003671480476359434, 'weight_decay': 0.00010131676605828896, 'w_return': 0.5, 'lambda_turnover': 0.3, 'target_mode': 'cs_demean'}
[I 2026-09-19 11:36:40,045] Trial 3 finished with value: -8.767827916764435e-05 and parameters: {'dropout': 0.1, 'lr': 0.0003671480476359434, 'weight_decay': 0.00010131676605828896, 'w_return': 0.5, 'lambda_turnover': 0.3, 'target_mode': 'cs_demean'}. Best is trial 4 with value: 0.053341794983132365.
trial 6: IC -0.0464  valSharpe 0.549  best_ep 1  params {'dropout': 0.2, 'lr': 0.00024855117889304275, 'weight_decay': 1.665931010323424e-05, 'w_return': 0.7, 'lambda_turnover': 1.0, 'target_mode': 'cs_demean'}
[I 2026-09-19 11:39:06,063] Trial 6 finished with value: -0.0464319115534921 and parameters: {'dropout': 0.2, 'lr': 0.00024855117889304275, 'weight_decay': 1.665931010323424e-05, 'w_return': 0.7, 'lambda_turnover': 1.0, 'target_mode': 'cs_demean'}. Best is trial 4 with value: 0.053341794983132365.
trial 7: IC -0.0403  valSharpe -0.142  best_ep 3  params {'dropout': 0.4, 'lr': 0.0003690786787496385, 'weight_decay': 2.4228546367439063e-05, 'w_return': 0.7, 'lambda_turnover': 0.3, 'target_mode': 'raw'}
[I 2026-09-19 11:41:54,708] Trial 7 finished with value: -0.04032365810481312 and parameters: {'dropout': 0.4, 'lr': 0.0003690786787496385, 'weight_decay': 2.4228546367439063e-05, 'w_return': 0.7, 'lambda_turnover': 0.3, 'target_mode': 'raw'}. Best is trial 4 with value: 0.053341794983132365.
trial 9: IC 0.0788  valSharpe 3.066  best_ep 4  params {'dropout': 0.30000000000000004, 'lr': 0.0028781002826092387, 'weight_decay': 0.0005717421310401361, 'w_return': 0.6000000000000001, 'lambda_turnover': 0.0, 'target_mode': 'raw'}
[I 2026-09-19 11:44:00,692] Trial 9 finished with value: 0.0788185978155583 and parameters: {'dropout': 0.30000000000000004, 'lr': 0.0028781002826092387, 'weight_decay': 0.0005717421310401361, 'w_return': 0.6000000000000001, 'lambda_turnover': 0.0, 'target_mode': 'raw'}. Best is trial 9 with value: 0.0788185978155583.
trial 11: IC 0.0076  valSharpe 1.090  best_ep 4  params {'dropout': 0.4, 'lr': 0.001218895679193332, 'weight_decay': 9.073533664735499e-05, 'w_return': 0.4, 'lambda_turnover': 0.0, 'target_mode': 'raw'}
[I 2026-09-19 11:46:07,779] Trial 11 finished with value: 0.007590433882227193 and parameters: {'dropout': 0.4, 'lr': 0.001218895679193332, 'weight_decay': 9.073533664735499e-05, 'w_return': 0.4, 'lambda_turnover': 0.0, 'target_mode': 'raw'}. Best is trial 9 with value: 0.0788185978155583.
trial 13: IC 0.0155  valSharpe 1.597  best_ep 4  params {'dropout': 0.30000000000000004, 'lr': 0.0010290844758983004, 'weight_decay': 0.0008677896467328156, 'w_return': 0.6000000000000001, 'lambda_turnover': 0.0, 'target_mode': 'raw'}
[I 2026-09-19 11:48:14,284] Trial 13 finished with value: 0.015514880256521592 and parameters: {'dropout': 0.30000000000000004, 'lr': 0.0010290844758983004, 'weight_decay': 0.0008677896467328156, 'w_return': 0.6000000000000001, 'lambda_turnover': 0.0, 'target_mode': 'raw'}. Best is trial 9 with value: 0.0788185978155583.
trial 15: IC -0.0023  valSharpe 0.757  best_ep 5  params {'dropout': 0.5, 'lr': 0.0009075105956307492, 'weight_decay': 0.0002236416898924597, 'w_return': 0.7, 'lambda_turnover': 0.0, 'target_mode': 'raw'}
[I 2026-09-19 11:50:29,595] Trial 15 finished with value: -0.0022545843214536268 and parameters: {'dropout': 0.5, 'lr': 0.0009075105956307492, 'weight_decay': 0.0002236416898924597, 'w_return': 0.7, 'lambda_turnover': 0.0, 'target_mode': 'raw'}. Best is trial 9 with value: 0.0788185978155583.
trial 17: IC 0.0220  valSharpe 2.930  best_ep 4  params {'dropout': 0.30000000000000004, 'lr': 0.002119151142295771, 'weight_decay': 0.00015505437647972035, 'w_return': 0.6000000000000001, 'lambda_turnover': 0.0, 'target_mode': 'raw'}
[I 2026-09-19 11:52:34,702] Trial 17 finished with value: 0.021971866493746123 and parameters: {'dropout': 0.30000000000000004, 'lr': 0.002119151142295771, 'weight_decay': 0.00015505437647972035, 'w_return': 0.6000000000000001, 'lambda_turnover': 0.0, 'target_mode': 'raw'}. Best is trial 9 with value: 0.0788185978155583.
trial 18: IC 0.0317  valSharpe 0.523  best_ep 4  params {'dropout': 0.2, 'lr': 0.0020998651232681407, 'weight_decay': 0.00041374178589029774, 'w_return': 0.5, 'lambda_turnover': 0.0, 'target_mode': 'raw'}
[I 2026-09-19 11:54:41,201] Trial 18 finished with value: 0.031689435184875915 and parameters: {'dropout': 0.2, 'lr': 0.0020998651232681407, 'weight_decay': 0.00041374178589029774, 'w_return': 0.5, 'lambda_turnover': 0.0, 'target_mode': 'raw'}. Best is trial 9 with value: 0.0788185978155583.
trial 20: IC -0.0212  valSharpe 0.762  best_ep 5  params {'dropout': 0.2, 'lr': 0.0005571841036015185, 'weight_decay': 0.000859419867664256, 'w_return': 0.7, 'lambda_turnover': 0.0, 'target_mode': 'raw'}
[I 2026-09-19 11:56:59,106] Trial 20 finished with value: -0.021234844183172452 and parameters: {'dropout': 0.2, 'lr': 0.0005571841036015185, 'weight_decay': 0.000859419867664256, 'w_return': 0.7, 'lambda_turnover': 0.0, 'target_mode': 'raw'}. Best is trial 9 with value: 0.0788185978155583.
trial 22: IC 0.0001  valSharpe -0.482  best_ep 5  params {'dropout': 0.1, 'lr': 0.0022088274166663555, 'weight_decay': 0.0007830668970455999, 'w_return': 0.6000000000000001, 'lambda_turnover': 1.0, 'target_mode': 'raw'}
[I 2026-09-19 12:00:17,272] Trial 22 finished with value: 5.427702996092104e-05 and parameters: {'dropout': 0.1, 'lr': 0.0022088274166663555, 'weight_decay': 0.0007830668970455999, 'w_return': 0.6000000000000001, 'lambda_turnover': 1.0, 'target_mode': 'raw'}. Best is trial 9 with value: 0.0788185978155583.
BEST: {'params': {'dropout': 0.30000000000000004, 'lr': 0.0028781002826092387, 'weight_decay': 0.0005717421310401361, 'w_return': 0.6000000000000001, 'lambda_turnover': 0.0, 'target_mode': 'raw'}, 'val_ic': 0.0788185978155583, 'best_epoch': 4, 'val_sharpe': 3.066010344903518}
